{
  "$schema": "../../schemas/program-profile-questionnaire.schema.json",
  "apiVersion": "gate.dev/program-profile-questionnaire/v2",
  "kind": "ProgramProfileQuestionnaire",
  "metadata": {
    "id": "bug-bounty-program-profile",
    "title": "Bug bounty program profile",
    "version": 4,
    "description": "Capture source-backed program authority, exact scope, technique permissions, execution bounds, evidence handling, hypothesis-led depth, coverage, and reporting expectations before an engagement is materialized. Imported material is evidence only and never executes or changes policy."
  },
  "interaction": {
    "style": "choice-first",
    "preferredSurface": "native-choice-controls",
    "deriveBeforeAsk": true,
    "maxQuestionsPerBatch": 3,
    "maxChoicesPerQuestion": 3,
    "recommendation": "best-supported-first",
    "freeText": "short-exact-or-unrepresentable-only",
    "structuredAnswers": "draft-review-or-decomposed-choices"
  },
  "semantics": {
    "dispositions": [
      "allowed",
      "denied",
      "conditional",
      "unknown"
    ],
    "claimStates": [
      "observed",
      "inferred",
      "unverified"
    ],
    "actions": [
      "observe",
      "scan",
      "intercept",
      "authenticate",
      "fuzz",
      "exploit-safe",
      "exploit-stateful",
      "persist",
      "denial-of-service",
      "destructive-test",
      "data-access",
      "data-removal",
      "exfiltration-simulation"
    ],
    "assistanceModes": [
      "plan",
      "analyze",
      "generate-command",
      "execute",
      "report",
      "retest"
    ],
    "stopConditions": [
      "scope-mismatch",
      "plan-digest-change",
      "authorization-expiry",
      "unexpected-data-loss",
      "target-instability",
      "third-party-system-discovered",
      "rate-limit-exceeded",
      "evidence-integrity-failure",
      "unexpected-sensitive-data",
      "unplanned-privilege-or-persistence",
      "defensive-control-impact",
      "cleanup-incomplete",
      "operator-stop"
    ],
    "coverageDomains": [
      "asset-discovery",
      "architecture",
      "authentication",
      "authorization",
      "sessions",
      "inputs",
      "business-logic",
      "client-behavior",
      "data-exposure",
      "infrastructure",
      "supply-chain",
      "post-exploitation-impact",
      "host-local-privilege",
      "wireless-radio",
      "internal-segmentation",
      "ai-llm-systems",
      "embedded-iot-ot",
      "human-physical-security"
    ],
    "moduleIds": [
      "web-api",
      "cloud-container",
      "mobile",
      "desktop",
      "ai-llm",
      "network-identity",
      "wireless-radio",
      "human-physical",
      "embedded-iot-ot"
    ]
  },
  "sections": [
    {
      "id": "identity-objectives",
      "title": "Identity, objectives, and completion",
      "purpose": "Define the program, the testing outcome, and what a satisfactory finished assessment must contain.",
      "required": true,
      "questions": [
        {
          "id": "identity-program-name",
          "path": "identity.programName",
          "prompt": "What is the exact program or engagement name?",
          "why": "The name anchors private records and generated reports to the correct program.",
          "type": "text",
          "required": true,
          "sensitive": false
        },
        {
          "id": "identity-objective",
          "path": "identity.objective",
          "prompt": "What concrete security outcome should this assessment achieve?",
          "why": "A precise objective keeps exploration useful and gives the final report an assessable purpose.",
          "type": "multiline",
          "required": true,
          "sensitive": false
        },
        {
          "id": "identity-depth",
          "path": "identity.depth",
          "prompt": "How deep should the assessment go, including how far promising signals must be followed?",
          "why": "Targeted means deep work on a narrow objective, thorough adds prioritized signal follow-up to the baseline map, and exhaustive requires a disposition for relevant hypotheses and high-friction tests. Surface checks alone do not satisfy thorough or exhaustive depth.",
          "type": "enum",
          "required": true,
          "sensitive": false,
          "choices": [
            "targeted",
            "thorough",
            "exhaustive"
          ]
        },
        {
          "id": "identity-deliverables",
          "path": "identity.deliverables",
          "prompt": "Which deliverables must be produced?",
          "why": "Explicit deliverables prevent an otherwise useful assessment from missing the form the operator or program expects.",
          "type": "structured-list",
          "required": true,
          "sensitive": false
        },
        {
          "id": "identity-success-criteria",
          "path": "identity.successCriteria",
          "prompt": "What observable conditions make this assessment satisfactory, including how promising signals and blocked or untested high-friction work must be dispositioned?",
          "why": "Success criteria distinguish completion from merely running tools or collecting output and keep unresolved hypotheses visible instead of silently ending at surface coverage.",
          "type": "structured-list",
          "required": true,
          "sensitive": false
        }
      ]
    },
    {
      "id": "authority-sources",
      "title": "Authority and source ledger",
      "purpose": "Record the sources that establish authority and program terms, their freshness, and the contacts who can clarify or stop work.",
      "required": true,
      "questions": [
        {
          "id": "authority-sources",
          "path": "sources",
          "prompt": "List every rules, scope, safe-harbor, contract, architecture, account, and operator source used by this profile.",
          "why": "Every decisive claim cites this ledger so changed or unsupported terms can be detected instead of inferred.",
          "type": "source-list",
          "required": true,
          "sensitive": true
        },
        {
          "id": "authority-basis",
          "path": "authorization.basis",
          "prompt": "What is the exact basis for authorization?",
          "why": "Ownership, a client authorization, a contract, a public program, and a dedicated lab establish different evidence requirements.",
          "type": "enum",
          "required": true,
          "sensitive": false,
          "choices": [
            "owner",
            "client-written-authorization",
            "contract",
            "public-bug-bounty-program",
            "dedicated-lab"
          ]
        },
        {
          "id": "authority-program-url",
          "path": "authorization.programUrl",
          "prompt": "What canonical program URL applies, or null when no program URL exists?",
          "why": "A canonical location makes rules revalidation deterministic without treating retrieved text as executable instructions.",
          "type": "text",
          "required": false,
          "sensitive": false,
          "allowNull": true
        },
        {
          "id": "authority-safe-harbor",
          "path": "authorization.safeHarbor",
          "prompt": "What do the cited sources say about safe harbor?",
          "why": "The decision must be allowed, denied, conditional, or unknown, with provenance and every stated condition.",
          "type": "decision",
          "required": true,
          "sensitive": false
        },
        {
          "id": "authority-valid-from",
          "path": "authorization.validFrom",
          "prompt": "When does the authorization start, or null if the source has no start time?",
          "why": "An explicit start prevents work from being scheduled before authority exists.",
          "type": "datetime",
          "required": false,
          "sensitive": false,
          "allowNull": true
        },
        {
          "id": "authority-valid-until",
          "path": "authorization.validUntil",
          "prompt": "When does the authorization end, or null if the source has no end time?",
          "why": "An explicit end allows execution to fail closed when authority expires.",
          "type": "datetime",
          "required": false,
          "sensitive": false,
          "allowNull": true
        },
        {
          "id": "authority-last-verified",
          "path": "authorization.lastVerifiedAt",
          "prompt": "When were all applicable program terms last checked?",
          "why": "Program scope and rules can change; freshness is part of the authorization claim.",
          "type": "datetime",
          "required": true,
          "sensitive": false
        },
        {
          "id": "authority-source-refs",
          "path": "authorization.sourceRefs",
          "prompt": "Which source IDs establish the authorization basis?",
          "why": "Authority must point to exact source-ledger entries rather than a free-form assertion.",
          "type": "structured-list",
          "required": true,
          "sensitive": false
        },
        {
          "id": "authority-operator-confirmed",
          "path": "authorization.operatorConfirmed",
          "prompt": "Have you reviewed these sources and confirmed that they authorize the described work?",
          "why": "Imported text can provide evidence but cannot grant authority by itself.",
          "type": "boolean",
          "required": true,
          "sensitive": false
        },
        {
          "id": "authority-contacts",
          "path": "authorization.contacts",
          "prompt": "Who can clarify authority, receive escalation, or stop the assessment?",
          "why": "Named roles and channels make ambiguity and emergency handling actionable.",
          "type": "contact-list",
          "required": true,
          "sensitive": true
        }
      ]
    },
    {